{
  "$schema": "../../../schemas/spec.schema.json",
  "schema_version": "2.0.0",
  "suite": {
    "id": "typical8",
    "title": "典型 8 算子 — 首批来源用例",
    "status": "draft",
    "target": {
      "architecture": "riscv64",
      "backend": "spacemit",
      "device": "SpacemiT K3"
    },
    "coverage": {
      "scope": "typical",
      "planned_case_count": 80
    }
  },
  "sources": [
    {
      "id": "source_document",
      "kind": "document",
      "title": "8 个典型算子：接口说明与典型用例（2026-09-25）",
      "location": "docs/specs/2026-10-08-典型8算子评测集.md#附证据与来源",
      "revision": null,
      "revision_status": "not_applicable"
    },
    {
      "id": "flaggems",
      "kind": "repository",
      "title": "FlagGems",
      "location": "FlagGems master（来源文档绑定）",
      "revision": "d17e23e48",
      "revision_status": "abbreviated"
    },
    {
      "id": "cannbench",
      "kind": "repository",
      "title": "CANNBench",
      "location": "CANNBench tasks/level2 与 tasks/level3",
      "revision": null,
      "revision_status": "unresolved"
    }
  ],
  "policies": {
    "input_reuse": "same_materialized_inputs",
    "implicit_shape_override": "forbidden",
    "implicit_dtype_fallback": "forbidden",
    "unknown_check": "not_passed",
    "timing": {
      "scope": "call",
      "unit": "ms",
      "statistic": "median",
      "preparation": "excluded",
      "contract": {
        "status": "pending",
        "reason": "既有 timing-contract.md 尚未迁入本仓；M3/M4 绑定其版本与内容摘要后计时。"
      }
    }
  },
  "operators": [
    {
      "id": "abs",
      "display_name": "abs",
      "entry_ref": null,
      "classification": {
        "level": "L1",
        "family": "elementwise",
        "basis": "source_document"
      },
      "call": {
        "args": [
          {
            "kind": "input",
            "name": "x"
          }
        ],
        "kwargs": {},
        "implementations": {
          "candidate": {
            "kind": "python_symbol",
            "id": "flag_gems.abs"
          },
          "reference": {
            "kind": "python_symbol",
            "id": "torch.abs"
          }
        }
      },
      "returns": {
        "kind": "tensor",
        "names": [
          "out"
        ]
      },
      "cases": [
        {
          "id": "typical8.abs.C01",
          "slot": "C01",
          "inputs": [
            {
              "name": "x",
              "kind": "tensor",
              "shape": [
                1024,
                1024
              ],
              "dtype": "float32",
              "layout": {
                "kind": "contiguous",
                "axes": [
                  "row",
                  "column"
                ]
              },
              "generator": {
                "kind": "torch_cpu_uniform_v1",
                "seed": 0,
                "low": -10,
                "high": 10
              }
            }
          ],
          "attrs": {},
          "outputs": [
            {
              "name": "out",
              "kind": "tensor",
              "shape": [
                1024,
                1024
              ],
              "dtype": "float32",
              "layout": {
                "kind": "contiguous",
                "axes": [
                  "row",
                  "column"
                ]
              }
            }
          ],
          "verification": {
            "output_checks": [
              {
                "output": "out",
                "method": "exact_values",
                "contract": null,
                "reason": null
              }
            ],
            "semantic_rules": []
          },
          "execution": {
            "status": "pending_probe",
            "reason": "尚未完成 M2：目标版本、调用适配器与板上支持性未验证。",
            "evidence": []
          },
          "provenance": {
            "source_refs": [
              "source_document",
              "flaggems"
            ],
            "locator": "tests/test_abs.py: POINTWISE_SHAPES[2] × float32",
            "basis": "source_typical",
            "note": "非原地实数 abs；C01 仅比较数值，不要求 ±0.0 位模式一致。"
          }
        }
      ]
    },
    {
      "id": "aminmax",
      "display_name": "aminmax",
      "entry_ref": null,
      "classification": {
        "level": "L1",
        "family": "reduction",
        "basis": "source_document"
      },
      "call": {
        "args": [
          {
            "kind": "input",
            "name": "x"
          }
        ],
        "kwargs": {
          "dim": {
            "kind": "attr",
            "name": "dim"
          },
          "keepdim": {
            "kind": "attr",
            "name": "keepdim"
          }
        },
        "implementations": {
          "candidate": {
            "kind": "python_symbol",
            "id": "flag_gems.aminmax"
          },
          "reference": {
            "kind": "python_symbol",
            "id": "torch.aminmax"
          }
        }
      },
      "returns": {
        "kind": "tuple",
        "names": [
          "min",
          "max"
        ]
      },
      "cases": [
        {
          "id": "typical8.aminmax.C01",
          "slot": "C01",
          "inputs": [
            {
              "name": "x",
              "kind": "tensor",
              "shape": [
                4096,
                256
              ],
              "dtype": "float16",
              "layout": {
                "kind": "contiguous",
                "axes": [
                  "row",
                  "column"
                ]
              },
              "generator": {
                "kind": "torch_cpu_uniform_v1",
                "seed": 0,
                "low": -1,
                "high": 1
              }
            }
          ],
          "attrs": {
            "dim": 1,
            "keepdim": false
          },
          "outputs": [
            {
              "name": "min",
              "kind": "tensor",
              "shape": [
                4096
              ],
              "dtype": "float16",
              "layout": {
                "kind": "contiguous",
                "axes": [
                  "row"
                ]
              }
            },
            {
              "name": "max",
              "kind": "tensor",
              "shape": [
                4096
              ],
              "dtype": "float16",
              "layout": {
                "kind": "contiguous",
                "axes": [
                  "row"
                ]
              }
            }
          ],
          "verification": {
            "output_checks": [
              {
                "output": "min",
                "method": "exact_values",
                "contract": null,
                "reason": null
              },
              {
                "output": "max",
                "method": "exact_values",
                "contract": null,
                "reason": null
              }
            ],
            "semantic_rules": []
          },
          "execution": {
            "status": "pending_probe",
            "reason": "尚未完成 M2：目标版本、调用适配器与板上支持性未验证。",
            "evidence": []
          },
          "provenance": {
            "source_refs": [
              "source_document",
              "flaggems"
            ],
            "locator": "tests/test_aminmax.py: REDUCTION_SHAPES[1] × float16",
            "basis": "source_typical",
            "note": "精确选择值；零符号的数值相等与位相等分开定义。"
          }
        }
      ]
    },
    {
      "id": "softmax",
      "display_name": "softmax",
      "entry_ref": null,
      "classification": {
        "level": "L1",
        "family": "reduction",
        "basis": "source_document"
      },
      "call": {
        "args": [
          {
            "kind": "input",
            "name": "x"
          },
          {
            "kind": "attr",
            "name": "dim"
          },
          {
            "kind": "attr",
            "name": "half_to_float"
          }
        ],
        "kwargs": {},
        "implementations": {
          "candidate": {
            "kind": "python_symbol",
            "id": "flag_gems.softmax"
          },
          "reference": {
            "kind": "python_symbol",
            "id": "torch.ops.aten._softmax.default"
          }
        }
      },
      "returns": {
        "kind": "tensor",
        "names": [
          "out"
        ]
      },
      "cases": [
        {
          "id": "typical8.softmax.C01",
          "slot": "C01",
          "inputs": [
            {
              "name": "x",
              "kind": "tensor",
              "shape": [
                1024,
                1024
              ],
              "dtype": "float16",
              "layout": {
                "kind": "contiguous",
                "axes": [
                  "row",
                  "column"
                ]
              },
              "generator": {
                "kind": "torch_cpu_uniform_v1",
                "seed": 0,
                "low": -1,
                "high": 1
              }
            }
          ],
          "attrs": {
            "dim": -1,
            "half_to_float": false
          },
          "outputs": [
            {
              "name": "out",
              "kind": "tensor",
              "shape": [
                1024,
                1024
              ],
              "dtype": "float16",
              "layout": {
                "kind": "contiguous",
                "axes": [
                  "row",
                  "column"
                ]
              }
            }
          ],
          "verification": {
            "output_checks": [
              {
                "output": "out",
                "method": "allclose",
                "contract": {
                  "status": "pending",
                  "reason": "M2 采集误差后在 M3 裁决；未沿用服务端宽松默认容差。"
                },
                "reason": null
              }
            ],
            "semantic_rules": [